headline,category,url
"In South Korea, even your cup of Starbucks could be too political",Business,https://www.bbc.com/news/articles/clyggex25v6o
"US House passes Trump's 'big, beautiful' tax and spending bill",Business,https://www.bbc.com/news/articles/c5yg0kgg2njo
Trump administration ends Harvard's ability to enrol international students,Business,https://www.bbc.com/news/articles/c05768jmm11o
US Treasury confirms the end of the penny,Business,https://www.bbc.com/news/articles/cx2j07858lno
US Congress moves to block California ban on petrol-only cars,Business,https://www.bbc.com/news/articles/cvgq4wxd583o
Nike to raise US prices as firms face tariffs uncertainty,Business,https://www.bbc.com/news/articles/c3315er3gygo
How a joke about rice cost a Japan cabinet minister his job,Business,https://www.bbc.com/news/articles/cj42vjrdz1no
"M&S website back online, allowing users to browse",Business,https://www.bbc.com/news/articles/c0k374x1y8do
Trump meets Republican hard-liners in hopes of moving tax bill forward,Business,https://www.bbc.com/news/articles/cje778q8nl7o
Daily Telegraph to be sold to US firm RedBird,Business,https://www.bbc.com/news/articles/c4gk8m1lrmlo
Labubu fan fury after dolls pulled from stores,Business,https://www.bbc.com/news/articles/cvgvwvvlnv3o
"A look at the key items in Trump's 'big, beautiful bill'",Business,https://www.bbc.com/news/articles/c0eqpz23l9jo
Denmark to raise retirement age to highest in Europe,Business,https://www.bbc.com/news/articles/cvg71v533q6o
"In South Korea, even your cup of Starbucks could be too political",Business,https://www.bbc.com/news/articles/clyggex25v6o
"US House passes Trump's 'big, beautiful' tax and spending bill",Business,https://www.bbc.com/news/articles/c5yg0kgg2njo
Trump administration ends Harvard's ability to enrol international students,Business,https://www.bbc.com/news/articles/c05768jmm11o
US Treasury confirms the end of the penny,Business,https://www.bbc.com/news/articles/cx2j07858lno
US Congress moves to block California ban on petrol-only cars,Business,https://www.bbc.com/news/articles/cvgq4wxd583o
Nike to raise US prices as firms face tariffs uncertainty,Business,https://www.bbc.com/news/articles/c3315er3gygo
How a joke about rice cost a Japan cabinet minister his job,Business,https://www.bbc.com/news/articles/cj42vjrdz1no
"M&S website back online, allowing users to browse",Business,https://www.bbc.com/news/articles/c0k374x1y8do
Trump meets Republican hard-liners in hopes of moving tax bill forward,Business,https://www.bbc.com/news/articles/cje778q8nl7o
Four obstacles for Republican rebels in Trump's tax bill,Business,https://www.bbc.com/news/articles/cx2jxn8m88ro
Target sales hit as Trump tariffs take effect,Business,https://www.bbc.com/news/articles/c30885gj1leo
'World's greatest designer' Jony Ive joins OpenAI to 'reimagine' computers,Business,https://www.bbc.com/news/articles/c5y66yemjdmo
Did Trump really strike Gulf deals worth $2tn?,Business,https://www.bbc.com/news/articles/cn5yxp2v77ro
No money left at the end of the month and smaller food shops: How inflation rise affects you,Business,https://www.bbc.com/news/articles/cy8nndp9l8po
Nvidia boss calls US chip policy a 'failure',Business,https://www.bbc.com/news/articles/c1ldd10m98eo
Elon Musk plans to cut back political spending,Business,https://www.bbc.com/news/articles/c20nnx11v5lo
X restricted in Tanzania after police targeted by hackers,Business,https://www.bbc.com/news/articles/cgmjjdrlkz1o
Fortnite back on US Apple app store after ban lifted,Business,https://www.bbc.com/news/articles/c0711mrl470o
Trump pressures Republicans to back his 'big beautiful' tax bill,Business,https://www.bbc.com/news/articles/crmkkke0ewgo
Millions of consumers in UK could get £70 after Mastercard ruling,Business,https://www.bbc.com/news/articles/c14kkjyrk20o
Spain clamps down on Airbnb as tourism backlash returns for summer,Business,https://www.bbc.com/news/articles/c3wdd8lg581o
Tesla battery maker sees shares jump in Hong Kong debut,Business,https://www.bbc.com/news/articles/c3d4k1derzgo
EU plans €2 fee on small parcels in hit to Shein and Temu,Business,https://www.bbc.com/news/articles/cq699ymm81vo
"Cyber-attack threat keeps me awake at night, UK bank boss says",Business,https://www.bbc.com/news/articles/c4g3372vl3yo
Who are the winners and losers from the UK-EU agreement?,Business,https://www.bbc.com/news/articles/cz63d82z785o
Sesame Street heads to Netflix after Trump pulled funding,Business,https://www.bbc.com/news/articles/c80k7z8z77yo
Ryanair tells flight attendants to repay salary rises,Business,https://www.bbc.com/news/articles/cpqeelw04e9o
India's 'Silicon Valley' flooded after heavy rains,Business,https://www.bbc.com/news/articles/c7800l27ynzo
Why we need 'revolutionary' cooling tech,Business,https://www.bbc.com/news/articles/cpdzjev2d9wo
UK now best placed country on trade - Chancellor,Business,https://www.bbc.com/news/articles/ce802rygr02o
"UK-EU deal moves us on from Brexit rows, Starmer says",Business,https://www.bbc.com/news/articles/ce9v28r7vlxo
US debt downgrade drives up borrowing costs,Business,https://www.bbc.com/news/articles/cx2j03w10gno
Council trialling AI for special needs reports,Innovation,https://www.bbc.com/news/articles/cvg7633ygdvo
AI system resorts to blackmail if told it will be removed,Innovation,https://www.bbc.com/news/articles/cpqeng9d20go
Protestors accuse Trump of corruption as he hosts crypto gala dinner,Innovation,https://www.bbc.com/news/articles/c74nn4ppdvdo
'Give it time': ScotRail defends AI announcer Iona,Innovation,https://www.bbc.com/news/articles/c75337xn1v5o
'World's greatest designer' Jony Ive joins OpenAI to 'reimagine' computers,Innovation,https://www.bbc.com/news/articles/c5y66yemjdmo
"M&S website back online, allowing users to browse",Innovation,https://www.bbc.com/news/articles/c0k374x1y8do
Radiology department marks 50 years of advancement,Innovation,https://www.bbc.com/news/articles/cy8ddn2j441o
Rail network adds defibrillators to all platforms,Innovation,https://www.bbc.com/news/articles/ckgnyne0k4ro
UK exposes Russian cyber campaign targeting support for Ukraine,Innovation,https://www.bbc.com/news/articles/c17rrjdr79po
Rail network adds defibrillators to all platforms,Innovation,https://www.bbc.com/news/articles/ckgnyne0k4ro
UK exposes Russian cyber campaign targeting support for Ukraine,Innovation,https://www.bbc.com/news/articles/c17rrjdr79po
Nvidia boss calls US chip policy a 'failure',Innovation,https://www.bbc.com/news/articles/c1ldd10m98eo
National parking platform seeks to end 'hassle' of multiple parking apps,Innovation,https://www.bbc.com/news/articles/ckg44pgn2g4o
What regular saunas do for your health,Innovation,https://www.bbc.com/future/article/20250520-are-saunas-and-cold-plunges-good-for-your-health
Chance for national park visitors to see the stars,Innovation,https://www.bbc.com/news/articles/cdj99yv3vvpo
Artist's 'heartbreak' over AI generated images,Innovation,https://www.bbc.com/news/articles/cvg5nz78ygdo
Did Trump really strike Gulf deals worth $2tn?,Innovation,https://www.bbc.com/news/articles/cn5yxp2v77ro
AI chatbot to be embedded in Google search,Innovation,https://www.bbc.com/news/articles/cpw77qwd117o
"Cyber-attack threat keeps me awake at night, UK bank boss says",Innovation,https://www.bbc.com/news/articles/c4g3372vl3yo
Fortnite faces complaint from actors' union over AI Darth Vader,Innovation,https://www.bbc.com/news/articles/cn844l3eznqo
Scientists in a race to discover why our Universe exists,Innovation,https://www.bbc.com/news/articles/cjwvgevjjl6o
Can AI therapists really be an alternative to human help?,Innovation,https://www.bbc.com/news/articles/ced2ywg7246o
Melania Trump says new revenge porn law will protect children online,Innovation,https://www.bbc.com/news/articles/c74qnyz89y3o
Peers demand more protection from AI for creatives,Innovation,https://www.bbc.com/news/articles/c39xj284e14o
Struggling DNA testing firm 23andMe to be bought for $256m,Innovation,https://www.bbc.com/news/articles/c0ln0e5g6kgo
UK weather forecast more accurate with Met Office supercomputer,Innovation,https://www.bbc.com/news/articles/clyg4ygerpjo
Chasing storms from Japan to California,Innovation,https://www.bbc.com/future/article/20250516-the-pilots-chasing-sky-rivers-and-cyclones-from-japan-to-the-us
Workers optimistic but overwhelmed by AI - study,Innovation,https://www.bbc.com/news/articles/c3rpx1rl2nlo
UK driverless cars coming in 2027 - but Uber says it's ready now,Innovation,https://www.bbc.com/news/articles/c8jg80j771zo
The people stuck using ancient Windows computers,Innovation,https://www.bbc.com/future/article/20250516-the-people-stuck-using-ancient-windows-computers
Elton John brands UK government 'absolute losers' over AI copyright plans,Innovation,https://www.bbc.com/news/articles/c8jg0348yvxo
A letter from the M&S hackers landed in my inbox - this is what happened next,Innovation,https://www.bbc.com/news/articles/cgr5nen5gxyo
M&S hackers believed to have gained access through third party,Innovation,https://www.bbc.com/news/articles/cpqe213vw3po
AI and cyber attack centre will be 'leading force',Innovation,https://www.bbc.com/news/articles/c4g2xrw5jl8o
Mexico accuses MrBeast of exploiting Mayan pyramids,Innovation,https://www.bbc.com/news/articles/crr70vykk0wo
Tesco apologises after software issue hits website and app,Innovation,https://www.bbc.com/news/articles/c8re57856jmo
The space archaeologists preserving our cosmic history,Innovation,https://www.bbc.com/future/article/20250515-the-space-archaeologists-hoping-to-save-our-cosmic-history
The camera tech propelling shows like Adolescence,Innovation,https://www.bbc.com/news/articles/c62g6vdl3vqo
"UK needs more nuclear to power AI, says Amazon boss",Innovation,https://www.bbc.com/news/articles/cewd5014wpno
Leading crypto firm Coinbase faces up to $400m hit from cyber attack,Innovation,https://www.bbc.com/news/articles/c80k5plpx8do
Meet the team paid to break into top-secret bases,Innovation,https://www.bbc.com/news/articles/c8el64yyppro
"Bayesian crew unaware wind speeds of over 73mph could topple yacht, report finds",Innovation,https://www.bbc.com/news/articles/c331djzymz6o
Museum visitors to touch part of the moon and Mars,Innovation,https://www.bbc.com/news/articles/cgr5wllyqv5o
'They yanked their own plug': How Co-op averted an even worse cyber attack,Innovation,https://www.bbc.com/news/articles/cwy382w9eglo
Co-op says shelves to be more fully stocked this weekend,Innovation,https://www.bbc.com/news/articles/ckg4zrpk5p7o
Police force harnesses AI to help catch stalkers,Innovation,https://www.bbc.com/news/articles/ckg4816gj5yo
Will this woman be the first Briton to walk on the Moon?,Innovation,https://www.bbc.com/news/articles/czxyv3z710do
AI tool put to test sifting UK public views on botox and fillers,Innovation,https://www.bbc.com/news/articles/cpd4nxvw9lyo
New centre launches to tackle digital threats,Innovation,https://www.bbc.com/news/articles/c5yxg72e0qwo
How AI is transforming work for Bee Lady doctors,Innovation,https://www.bbc.com/news/articles/c1ld5n1vn7zo
The road that charges your car,Innovation,https://www.bbc.com/news/videos/c0eq8jqr2zvo
How to avoid a puncture on the Moon,Innovation,https://www.bbc.com/news/articles/czrve1zrlg3o
Politician's wife jailed for X post gets appeal date,Innovation,https://www.bbc.com/news/articles/cwyjgx04dxdo
How gardening boosts brain health,Innovation,https://www.bbc.com/future/article/20250509-how-gardening-boosts-brain-health
Mars rover technology tested out in Scottish Highlands,Innovation,https://www.bbc.com/news/articles/clygleqg409o
Soviet-era spacecraft 'likely' to have re-entered Earth's atmosphere,Innovation,https://www.bbc.com/news/articles/cy9vz28nyedo
Is there really an autism 'epidemic'?,Innovation,https://www.bbc.com/future/article/20250509-why-autism-diagnoses-are-on-the-rise
Elton John and Dua Lipa seek protection from AI,Innovation,https://www.bbc.com/news/articles/c071elp1rv1o
Two porn sites investigated for suspected age check failings,Innovation,https://www.bbc.com/news/articles/cx2qn1j0jd6o
Bill Gates plans to give away most of his fortune by 2045,Innovation,https://www.bbc.com/news/articles/cx2e87lzqkdo
The country sparking Africa's e-bike revolution,Innovation,https://www.bbc.com/future/article/20250508-rwanda-is-sparking-africas-e-bike-revolution
"Pay day banking outages hit 1.2m people, UK banks reveal",Innovation,https://www.bbc.com/news/articles/c7875w07l93o
Apple hits back at US judge's 'extraordinary' contempt order,Innovation,https://www.bbc.com/news/articles/c3r8rg4w2v0o
The surprising power of nose breathing,Innovation,https://www.bbc.com/future/article/20250507-the-surprising-power-of-breathing-through-your-nose
Wikipedia legally challenges 'flawed' online safety rules,Innovation,https://www.bbc.com/news/articles/c62j2gr8866o
Arizona man shot dead in road rage 'returns' to address his killer,Innovation,https://www.bbc.com/news/articles/cq808px90wxo
Maker of Pegasus spyware told to pay $167m for WhatsApp hack,Innovation,https://www.bbc.com/news/articles/c77n76kzmz4o
Renewable energy's trouble with 'wind theft',Innovation,https://www.bbc.com/future/article/20250506-renewable-energys-trouble-with-wind-theft
"Ofcom needs more powers to remove misleading posts, says watchdog",Innovation,https://www.bbc.com/news/articles/c0jzj18w77yo
China's alternative to charging electric cars,Innovation,https://www.bbc.com/future/article/20250506-are-chinas-swap-stations-the-future-of-electric-cars
Can AI care for your loved ones?,Innovation,https://www.bbc.com/news/articles/c62z5yl2l1lo
The people refusing to use AI,Innovation,https://www.bbc.com/news/articles/c15q5qzdjqxo
OpenAI says non-profit will remain in control after backlash,Innovation,https://www.bbc.com/news/articles/cwy603eg0w8o
"Beware phony IT calls after Co-op and M&S hacks, says UK cyber centre",Innovation,https://www.bbc.com/news/articles/c4grn878712o
Trump criticised after posting AI image of himself as Pope,Innovation,https://www.bbc.com/news/articles/cdrg8zkz8d0o
The bizarre space explosions we can't explain,Innovation,https://www.bbc.com/future/article/20250502-cow-flares-the-bizarre-space-explosions-scientists-cant-explain
Look up! This month's Milky Way and meteor magic,Innovation,https://www.bbc.com/news/videos/cy70z22208zo
Long-distance romance and closure from husband's death - your memories of Skype,Innovation,https://www.bbc.com/news/articles/cp913ze3k9jo
How a passion project became 2025's most talked-about game,Innovation,https://www.bbc.com/news/articles/c078j5gd71ro
How Katy Perry became the Hot and Cold popstar,Innovation,https://www.bbc.com/news/articles/cwynz85zj2vo
Uber starts allowing customers to pay in cash,Innovation,https://www.bbc.com/news/articles/c4g4le9n469o
"Co-op cyber attack affects customer data, firm admits, after hackers contact BBC",Innovation,https://www.bbc.com/news/articles/crkx3vy54nzo
Meta threatens to cut off Facebook in Nigeria over huge fines - report,Innovation,https://www.bbc.com/news/articles/ckgrwxp5r15o
Co-op gives away free pasta sauce and coffee by mistake,Innovation,https://www.bbc.com/news/articles/c9856ge2742o
Are heated tobacco products a new health risk?,Innovation,https://www.bbc.com/future/article/20250501-the-truth-about-heated-tobacco
How BBC investigation led to Apple removing AI 'nudify' apps,Innovation,https://www.bbc.com/news/videos/cx205lnplpwo
Apple says most US-bound iPhones no longer made in China,Innovation,https://www.bbc.com/news/articles/c86jx18y9e2o
Why Australia's opposition is vying for votes on Chinese social media,Innovation,https://www.bbc.com/news/articles/cqx4vr5nqr8o
Harrods latest UK retailer to be hit by cyber attack,Innovation,https://www.bbc.com/news/articles/c62x4zxe418o
Xbox prices hiked worldwide amid tariff uncertainty,Innovation,https://www.bbc.com/news/articles/cze1zn9d9p4o
'They wanted $4m': Lessons for M&S from other cyber attacks,Innovation,https://www.bbc.com/news/articles/cg72kg5yn2ko
Co-op cyber attack: Staff told to keep cameras on in meetings,Innovation,https://www.bbc.com/news/articles/cg72k851dd8o
Meta warns of 'worse' experience for European users,Innovation,https://www.bbc.com/news/articles/czd3mey1ej2o
AI turns old photos of the Borders into 'motion pictures',Innovation,https://www.bbc.com/news/videos/cq5wx27gne1o
Grandson's AI movies bring old towns back to life,Innovation,https://www.bbc.com/news/articles/c1k4y98vykro
Singapore's ruling party pulls out all stops online to woo youth,Innovation,https://www.bbc.com/news/articles/c5yldprrdg3o
UK trial aims to silence tinnitus before it takes hold,Innovation,https://www.bbc.com/news/videos/cd02x42z0ndo
Three things you might not know about the Sun,Innovation,https://www.bbc.com/news/videos/creq5yvlzryo
Apple referred for possible criminal contempt investigation,Innovation,https://www.bbc.com/news/articles/c62xv43xqq5o
'I turned a drawing passion into an animation career',Culture,https://www.bbc.com/news/articles/c1j5wzd0l4eo
Cross-cultural ceilidh marks world diversity day,Culture,https://www.bbc.com/news/articles/c93l9zzgq4wo
Fireworks from Sam Fender caps off Saturday at Big Weekend,Culture,https://www.bbc.com/news/articles/cdd23rnp3lvo
Musicians gather to raise funds for Ukraine supplies,Culture,https://www.bbc.com/news/articles/czr864xpl00o
King James I's gloves in 'unique' fashion tour,Culture,https://www.bbc.com/news/articles/c86105dgl1xo
Ed Sheeran thrills with surprise set at Big Weekend,Culture,https://www.bbc.com/news/articles/cpvk017zk0no
Businesses 'benefiting' from Radio 1's Big Weekend,Culture,https://www.bbc.com/news/articles/c057e1d51d5o
Bygone photos show life in Wales' oldest multi-ethnic community,Culture,https://www.bbc.com/news/articles/c79edpj39r2o
Jersey actor to appear in movie with Idris Elba,Culture,https://www.bbc.com/news/articles/c8jg1jd3knvo
Director Stanley Kubrick's house up for sale,Culture,https://www.bbc.com/news/articles/crlj0g6100no
Bygone photos show life in Wales' oldest multi-ethnic community,Culture,https://www.bbc.com/news/articles/c79edpj39r2o
'A long way home but I can't get enough of Scotland' - McGregor,Culture,https://www.bbc.com/news/articles/cn844wx8zv7o
Jersey actor to appear in movie with Idris Elba,Culture,https://www.bbc.com/news/articles/c8jg1jd3knvo
Line-up announced for BBC Black Sabbath special,Culture,https://www.bbc.com/news/articles/c0r11dqpwlwo
Gavin & Stacey motors join on-screen icons display,Culture,https://www.bbc.com/news/articles/cn4g11rk8yyo
‘It’s wild’: Myles Smith on his meteoric year since Big Weekend,Culture,https://www.bbc.com/news/articles/c17rrjdr8gjo
Kneecap defiant at first major gig since terror charge,Culture,https://www.bbc.com/news/articles/cz70lyqzeqeo
Tom Grennan lights up Liverpool for Radio 1's Big Weekend,Culture,https://www.bbc.com/news/articles/c3e5ngq4yk3o
Mountainhead: A 'nightmare' vision of the world ★★★★☆,Culture,https://www.bbc.com/culture/article/20250521-mountainhead-review
Billy Joel cancels tour after brain condition diagnosis,Culture,https://www.bbc.com/news/articles/cx2q95d4wy1o
Legendary photographer Sebastião Salgado dies at 81,Culture,https://www.bbc.com/news/articles/cx2exym29pdo
Council considers purchasing historic Assembly Rooms,Culture,https://www.bbc.com/news/articles/cvg9v381zzeo
Will Elden Ring film be 'awesome' or 'meh'? Fans have thoughts,Culture,https://www.bbc.com/news/articles/c5y5g16q062o
Converted church among architecture award winners,Culture,https://www.bbc.com/news/articles/cr7z970mdpyo
Taylor Swift won't face summons in Baldoni-Lively case,Culture,https://www.bbc.com/news/articles/cm2k0dmvvkgo
Jethro's J35 TER number plate sells for £30.5k,Culture,https://www.bbc.com/news/articles/cjwqnqe8wljo
The sounds and songs of Iceland's melting landscape,Culture,https://www.bbc.com/travel/article/20250521-the-sounds-and-songs-of-icelands-melting-landscape
This Brazilian thriller could be an Oscars hopeful ★★★★☆,Culture,https://www.bbc.com/culture/article/20250523-the-secret-agent-review
Black Sabbath murals to rock city ahead of gig,Culture,https://www.bbc.com/news/articles/cvgq47rprl1o
Helping rescued elephants after circus life,Culture,https://www.bbc.com/news/videos/cn4gg9w99jmo
Two castles and a prison on best buildings list,Culture,https://www.bbc.com/news/articles/c1e66200yqwo
Pair install blue plaques for city's lost clubs,Culture,https://www.bbc.com/news/articles/c0r1vppr5z4o
City show returns with 90s nostalgia theme,Culture,https://www.bbc.com/news/articles/cr7z9053ynyo
U2: 'We want to make the sound of the future',Culture,https://www.bbc.com/news/articles/cm2yl1n6kr5o
What not to miss at Radio 1's Big Weekend 2025,Culture,https://www.bbc.com/news/articles/c0r11l0rzgwo
The Indian film that got a nine-minute ovation at Cannes,Culture,https://www.bbc.com/news/articles/czelypr8jdlo
Kid Cudi testifies at Diddy trial about Molotov cocktail attack,Culture,https://www.bbc.com/news/articles/c17rwz24ky5o
'I'm hardly Bob Dylan': Charli XCX wins songwriter of the year,Culture,https://www.bbc.com/news/articles/cy75n53jk0ko
Glastonbury glampers' concern after yurt firm goes bust,Culture,https://www.bbc.com/news/articles/czelydedx44o
Weekly quiz: What song won Eurovision?,Culture,https://www.bbc.com/news/articles/cn846xgyw7eo
Kneecap at TRNSMT would need 'significant' police operation,Culture,https://www.bbc.com/news/articles/ced2g5xz552o
Bradford choir tempts Londoners to City of Culture,Culture,https://www.bbc.com/news/videos/c787n4ww75vo
Timothy West 'died peacefully' after hospital stay,Culture,https://www.bbc.com/news/articles/cgq377gyeglo
The young gig promoters boosting local music scene,Culture,https://www.bbc.com/news/articles/cwy660vzwwpo
Metallica to play at Hampden during new UK tour,Culture,https://www.bbc.com/news/articles/cwywxw70ed2o
A furious but funny revenge thriller is a favourite at Cannes ★★★★☆,Culture,https://www.bbc.com/culture/article/20250522-it-was-just-an-accident-review
Flying geese mural 'reflects city's changing face',Culture,https://www.bbc.com/news/articles/cje77gq7583o
Military intelligence exhibition for Blitz tunnels,Culture,https://www.bbc.com/news/articles/cq855l183p4o
Norwich Printing Museum pressed to find new home,Culture,https://www.bbc.com/news/articles/cx2ejdve5rgo
Gay romance The History of Sound is 'too polite' ★★☆☆☆,Culture,https://www.bbc.com/culture/article/20250521-the-history-of-sound-review-paul-mescal-and-josh-oconnors-gay-romance-is-too-polite
Chris Brown freed on £5m bail by London court,Culture,https://www.bbc.com/news/articles/cwy66xq1jjgo
Life-sized animal puppets to stampede across London,Culture,https://www.bbc.com/news/articles/cgr55k5njgno
Israel's Eurovision result prompts questions over voting,Culture,https://www.bbc.com/news/articles/ckg77pxj2mno
'I hated everybody but now I want to inspire others',Culture,https://www.bbc.com/news/articles/cj428jlz2eyo
India's Banu Mushtaq makes history with International Booker win,Culture,https://www.bbc.com/news/articles/c308qjpz9y2o
Cheers stars pay tribute to 'Norm' actor George Wendt,Culture,https://www.bbc.com/news/articles/cx2xx998102o
Artist's 'heartbreak' over AI generated images,Culture,https://www.bbc.com/news/articles/cvg5nz78ygdo
City attraction scoops prestigious award,Culture,https://www.bbc.com/news/articles/c79e3jgzvlxo
Castle confirms summer reopening after long delays,Culture,https://www.bbc.com/news/articles/c4gee77zqd2o
Lorraine's ITV show cut to 30 minutes as job cuts loom,Culture,https://www.bbc.com/news/articles/cjwqqvqxzxlo
Artist wins award for exhibition exploring disability,Culture,https://www.bbc.com/news/articles/c6288q9gexno
Council to spend £2.5m updating listed music venue,Culture,https://www.bbc.com/news/articles/c4grrxx979qo
This nightmarish virus horror is 'maddening' ★★☆☆☆,Culture,https://www.bbc.com/culture/article/20250520-alpha-review
Jurassic snark: New Zealand dinosaur sculpture fuels debate,Culture,https://www.bbc.com/news/articles/c4g77x1m9mno
"Boy, 11, becomes piano prodigy by watching YouTube",Culture,https://www.bbc.com/news/articles/c8rekvx8r0do
Festival to include walks of discovery on Dartmoor,Culture,https://www.bbc.com/news/articles/cwy3x12p00qo
Stolen Jim Morrison graveside bust found by chance after 37 years,Culture,https://www.bbc.com/news/articles/c74qqje4kzeo
Show planned for Oscar Wilde prison to be moved,Culture,https://www.bbc.com/news/articles/cpqe7x4pjy4o
Sesame Street heads to Netflix after Trump pulled funding,Culture,https://www.bbc.com/news/articles/c80k7z8z77yo
Spanish PM calls for Israel ban at Eurovision,Culture,https://www.bbc.com/news/articles/cn7zx836v6do
Lineker to leave BBC sooner than planned after antisemitism row,Culture,https://www.bbc.com/news/articles/c79e37nld1no
Ed Sheeran supports young talent in surprise gig,Culture,https://www.bbc.com/news/articles/cx2egr875kro
Gary Lineker: A sorry end to a BBC career,Culture,https://www.bbc.com/news/articles/cq54wy9jzgdo
How Gary Lineker went from football sensation to headline-hitting presenter,Culture,https://www.bbc.com/news/articles/cp39xlwexyxo
The only X-rated winner of the best-picture Oscar,Culture,https://www.bbc.com/culture/article/20250512-the-only-x-rated-winner-of-the-best-picture-oscar
Unsigned acts prepare to play for thousands at festival,Culture,https://www.bbc.com/news/articles/c3650wpwr7ko
'Learning Irish for my film helped with cancer recovery',Culture,https://www.bbc.com/news/articles/cx2q6lryp5wo
What's on at the new-look Shindig Festival?,Culture,https://www.bbc.com/news/articles/cn84lxpyqqpo
Art exhibition highlights problem of knife crime,Culture,https://www.bbc.com/news/articles/c39x00ln14zo
'I'm gigging with my former job adviser',Culture,https://www.bbc.com/news/articles/ce805r9lk7no
