headline,category,url
Gary Lineker expected to leave the BBC,Culture,https://www.bbc.com/news/articles/c626jxp0yz3o
'Last chance' to save town's Morris dancing group,Culture,https://www.bbc.com/news/articles/c626xzezn78o
Wes Anderson takes his quirkiness to 'new levels' ★★★☆☆,Culture,https://www.bbc.com/culture/article/20250518-the-phoenician-scheme-review-wes-anderson-takes-his-quirkiness-to-a-whole-new-level
"Mission: Impossible returns, and Nine Perfect Strangers: What's coming up this week",Culture,https://www.bbc.com/news/articles/czxy550q6vzo
Remember Monday singer says she's lost wedding ring after Eurovision,Culture,https://www.bbc.com/news/articles/cjdzx5v21ldo
Watch: Key moments from Eurovision 2025,Culture,https://www.bbc.com/news/videos/cy5en5yydplo
"Saunas, espresso and zero points: A look back at Eurovision 2025",Culture,https://www.bbc.com/news/videos/cd0ln1m54vzo
North-west England's best buildings revealed,Culture,https://www.bbc.com/news/articles/c15nzyg4ndpo
"'It took me almost 1,000 hours to draw London'",Culture,https://www.bbc.com/news/videos/c7876w8e751o
Science and Media Museum unveils new galleries,Culture,https://www.bbc.com/news/articles/c9q0jqgdy80o
The Soviet nuclear plan to reverse Siberian rivers,Earth,https://www.bbc.com/future/article/20250523-the-soviet-plan-to-reverse-siberias-rivers-with-peaceful-nuclear-explosions
William: David Attenborough was 'inspiration' for new show,Earth,https://www.bbc.com/news/articles/c3087vlmljmo
Busy hurricane season expected as forecasters fear Trump cuts,Earth,https://www.bbc.com/news/articles/cp855prygj1o
UK sea temperatures soar after exceptionally warm spring,Earth,https://www.bbc.com/news/articles/c7533y6l3k0o
'Shrinking Nemo': Smaller clownfish sound alarm on ocean heat,Earth,https://www.bbc.com/news/articles/c629z4y762xo
Tropical forests destroyed at fastest recorded rate last year,Earth,https://www.bbc.com/news/articles/c0lnngl6713o
"Coastlines in danger even if climate target met, scientists warn",Earth,https://www.bbc.com/news/articles/cj93e40znl3o
Chasing storms from Japan to California,Earth,https://www.bbc.com/future/article/20250516-the-pilots-chasing-sky-rivers-and-cyclones-from-japan-to-the-us
Mosquito-borne killer disease threatens blackbirds,Earth,https://www.bbc.com/news/articles/cj3x6v05ly6o
Mosquito-borne killer disease threatens blackbirds,Earth,https://www.bbc.com/news/articles/cj3x6v05ly6o
What chestnuts reveal about the Roman Empire,Earth,https://www.bbc.com/future/article/20250513-what-chestnuts-reveal-about-the-roman-empire
The seawall being built in Japan's turtle haven,Earth,https://www.bbc.com/future/article/20250512-how-a-concrete-seawall-split-this-japanese-island-village
The world's first deep sea mining test 50 years on,Earth,https://www.bbc.com/future/article/20250509-blake-plateau-the-uss-50-year-old-scars-from-the-worlds-first-deep-sea-mining-test-site
The country sparking Africa's e-bike revolution,Earth,https://www.bbc.com/future/article/20250508-rwanda-is-sparking-africas-e-bike-revolution
Renewable energy's trouble with 'wind theft',Earth,https://www.bbc.com/future/article/20250506-renewable-energys-trouble-with-wind-theft
Attenborough at 99 delivers 'greatest message he's ever told',Earth,https://www.bbc.com/news/articles/cn0wjxg0ex1o
China's alternative to charging electric cars,Earth,https://www.bbc.com/future/article/20250506-are-chinas-swap-stations-the-future-of-electric-cars
Why space debris is a looming crisis,Earth,https://www.bbc.com/reel/video/p0l7gtft/just-how-dangerous-is-space-debris-
How a burning river lit the US's green movement,Earth,https://www.bbc.com/future/article/20250429-how-the-cuyahoga-river-fires-fuelled-the-us-green-movement
The dark WW2 history written into Germany's parks,Earth,https://www.bbc.com/future/article/20250429-we-planted-trees-among-the-rubble-the-dark-ww2-history-written-into-germanys-parks
UK government not taking climate seriously - advisers,Earth,https://www.bbc.com/news/articles/cvgpey03pnno
The satellite that will 'weigh' world's 1.5 trillion trees,Earth,https://www.bbc.com/news/articles/crldwjj6d6no
The people 'meadowscaping' their lawns,Earth,https://www.bbc.com/future/article/20250425-meadowscaping-the-people-turning-their-garden-lawns-into-wild-meadows
Area burned by UK wildfires in 2025 already at annual record,Earth,https://www.bbc.com/news/articles/c0m9gm3jwljo
Is resurrecting extinct animals a good idea?,Earth,https://www.bbc.com/future/article/20250425-why-scientists-fear-attempts-to-resurrect-extinct-animals-may-backfire
The benefits of cleaning with vinegar,Earth,https://www.bbc.com/future/article/20250423-is-vinegar-safer-and-more-sustainable-than-other-cleaning-products
Fingerprints of city-sized icebergs found off UK coast,Earth,https://www.bbc.com/news/articles/cm2xz664r2do
The race against time to save US climate data,Earth,https://www.bbc.com/future/article/20250422-usa-scientists-race-to-save-climate-data-before-its-deleted-by-the-trump-administration
The images showing 50 years of change on Earth,Earth,https://www.bbc.com/future/article/20250422-how-50-years-of-climate-change-has-changed-the-face-of-the-blue-marble
Why alligators are the Everglades' bodyguards,Earth,https://www.bbc.com/future/article/20250417-how-alligators-keep-floridas-everglades-healthy
Why arsenic levels in rice are rising,Earth,https://www.bbc.com/future/article/20250417-how-climate-change-could-affect-arsenic-in-rice
Project to suck carbon out of sea begins in UK,Earth,https://www.bbc.com/news/articles/cr788kljlklo
The world's most surprising pollinators,Earth,https://www.bbc.com/future/article/20250416-where-bees-wont-go-how-cockroaches-bats-and-beetles-pollinate-the-worlds-plants-and-crops
Resurrecting Italy's 'dead' sea - with plants,Earth,https://www.bbc.com/future/article/20250411-saving-italys-polluted-mar-piccolo-using-plants
How climate change is supercharging allergies,Earth,https://www.bbc.com/future/article/20250410-how-climate-driven-thunderstorms-supercharge-pollen-allergies
The scientists who leave no trace in the high Arctic,Earth,https://www.bbc.com/future/article/20250408-the-scientists-leaving-no-trace-in-the-arctic
UK investigating claims green fuel contains virgin palm oil,Earth,https://www.bbc.com/news/articles/cm24n8nej94o
Fur is back in fashion - and even more divisive,Earth,https://www.bbc.com/culture/article/20250404-fur-is-back-in-fashion-and-even-more-divisive
Behind the scenes of the 'house of bears' photo,Earth,https://www.bbc.com/future/article/20250407-the-polar-bears-living-in-an-abandoned-arctic-weather-station
Where EV batteries go to die - and be reborn,Earth,https://www.bbc.com/future/article/20250404-where-ev-batteries-go-to-die-and-be-reborn
The 'freakosystem' accidentally created on Hawaii,Earth,https://www.bbc.com/future/article/20250403-the-new-hawaiian-freakosystem-emerging-on-oahu-accidentally-created-by-humans
"Meet Siku, the polar bear allergic to human hair",Earth,https://www.bbc.com/future/article/20250401-the-polar-bear-with-itchy-skin-do-wild-animals-get-allergies
Has Just Stop Oil really stopped throwing soup?,Earth,https://www.bbc.com/news/articles/cy0d047810no
How do you re-home a rhino? Upside down,Earth,https://www.bbc.com/future/article/20250327-the-vietnam-war-helicopters-riddled-with-bullet-holes-airlifting-rhinos-to-safety
"Mud, water and wood: The ancient forest that keeps Venice afloat",Earth,https://www.bbc.com/future/article/20250324-the-ancient-forest-that-supports-venice
Elephants hate bees - here's how that helps humans,Earth,https://www.bbc.com/future/article/20250320-how-bees-are-reducing-conflict-between-humans-and-elephants
This machine turns carbon dioxide into fuel,Earth,https://www.bbc.com/reel/video/p0kys7pd/this-machine-turns-carbon-dioxide-into-fuel
Why French towns are giving away free chickens,Earth,https://www.bbc.com/future/article/20250317-these-european-towns-in-france-and-belgium-hand-out-free-chickens
Scientists at Antarctic base rocked by alleged assault,Earth,https://www.bbc.com/news/articles/cgkm0k2j6edo
The dramatic photo of huskies walking on water,Earth,https://www.bbc.com/future/article/20250314-the-photo-of-husky-dogs-walking-on-water-that-reveals-the-reality-of-ice-melting-and-climate-change-in-greenland
What snow can teach us about street design,Earth,https://www.bbc.com/reel/video/p0kx9vx8/what-snow-can-teach-us-about-street-design
The women tackling India's worm poachers,Earth,https://www.bbc.com/future/article/20250311-the-women-fighting-indias-worm-poachers
Extreme ice-diving in the name of science,Earth,https://www.bbc.com/future/article/20250310-the-divers-venturing-under-the-ice-in-the-name-of-science
What we've learned since the biggest oil spill in US history,Earth,https://www.bbc.com/future/article/20240905-have-we-improved-oil-spill-clean-ups-since-bp-deepwater-horizon
The $1m cactus heist that led to a smuggler's downfall,Earth,https://www.bbc.com/future/article/20250228-how-italy-and-chile-foiled-an-1m-international-smugglers-cactus-heist
The VR experience that leaves people in tears,Earth,https://www.bbc.com/future/article/20250306-the-future-of-conservation-might-be-in-vr-headsets
What is a heat pump and how much do they cost?,Earth,https://www.bbc.com/news/science-environment-57159056
What's the most sustainable period product?,Earth,https://www.bbc.com/future/article/20250305-what-is-the-most-sustainable-period-product
UK homes install subsidised heat pumps at record level,Earth,https://www.bbc.com/news/articles/c3e4nlxlq08o
The world's strongest ocean current is at risk of failing,Earth,https://www.bbc.com/future/article/20250303-the-worlds-strongest-ocean-current-is-at-risk
Why Vermont farmers are using urine on their crops,Earth,https://www.bbc.com/future/article/20250227-the-vermont-farmers-using-urine-to-grow-their-crops
Nations salvage funding deal to reverse wildlife decline,Earth,https://www.bbc.com/news/articles/cg5ddnmnypvo
Heat pumps and EVs – how to fight climate change from home,Earth,https://www.bbc.com/news/articles/cpv4m3x1ldgo
"Half of UK homes need heat pump by 2040, government told",Earth,https://www.bbc.com/news/articles/c70ekknr2rwo
The farmers protecting Nepal's snow leopards,Earth,https://www.bbc.com/future/article/20250221-the-women-protecting-snow-leopards-in-remotest-nepal
Scientists probe gulls' 'weird and wonderful' appetites,Earth,https://www.bbc.com/news/articles/c2erkry8jn8o
The megacity facing a thirsty future,Earth,https://www.bbc.com/future/article/20250219-what-happens-if-istanbuls-water-supplies-run-dry
The ex-fracking site tapped for underground heat,Earth,https://www.bbc.com/future/article/20250219-kirby-misperton-the-former-fracking-site-now-tapped-for-clean-heat
World's glaciers melting faster than ever recorded,Earth,https://www.bbc.com/news/articles/cy4ly8vde85o
"How Trump's 'drill, baby, drill' pledge is affecting other countries",Earth,https://www.bbc.com/news/articles/ce85709xdk4o
The rewilded golf courses turned into a nature 'microcosm',Earth,https://www.bbc.com/future/article/20250214-from-scotland-to-california-the-rewilded-golf-courses-where-wildlife-thrives
World's sea-ice falls to record low,Earth,https://www.bbc.com/news/articles/cvgeydkz08go
What tortoises can teach us about solitary living,Earth,https://www.bbc.com/future/article/20250213-the-overlooked-advantages-of-being-a-solitary-animal
Hunt for rare daffodils that are feared lost,Earth,https://www.bbc.com/news/articles/c0qwvppk0zzo
Why 'snowy' New York winters are a bit of a myth,Earth,https://www.bbc.com/reel/video/p0kpvtc0/why-snowy-new-york-winters-are-a-bit-of-a-myth
How the history of humans is written into the Earth's fabric,Earth,https://www.bbc.com/future/article/20250210-how-the-history-of-humans-is-written-into-the-fabric-of-the-earth
The people turning beer waste into vegan bags,Earth,https://www.bbc.com/future/article/20250206-how-brewers-spent-grain-is-being-turned-into-vegan-barley-milk-leather-and-cakes
"£22bn for 'unproven' green tech could raise bills, UK MPs warn",Earth,https://www.bbc.com/news/articles/ce8jpj3z3n2o
Do cows speak to each other?,Earth,https://www.bbc.com/future/article/20250204-the-linguists-studying-how-cows-talk-to-each-other-in-language
Record January warmth puzzles climate scientists,Earth,https://www.bbc.com/news/articles/cwyjk92w9k1o
Spending on flood defences set to rise to record levels,Earth,https://www.bbc.com/news/articles/cly5rln4yd3o
The bugs transforming food waste into fertiliser,Earth,https://www.bbc.com/future/article/20250130-the-little-bug-with-a-big-appetite-turning-organic-waste-into-sustainable-fertiliser
"Why scientists are counting tiny marine creatures, from Space",Earth,https://www.bbc.com/news/articles/c20g41845jdo
UK unprepared for climate change impacts - fire chiefs council,Earth,https://www.bbc.com/news/articles/cgkj8ljvmkyo
Why the flavour of beer is fading,Earth,https://www.bbc.com/future/article/20250131-how-the-climate-is-changing-the-taste-of-beer
How a month of abstinence can lead to 'meat disgust',Earth,https://www.bbc.com/future/article/20250130-how-a-month-of-abstinence-can-lead-to-meat-disgust
Could the UK actually get colder with global warming?,Earth,https://www.bbc.com/news/articles/cn938ze4yyeo
Colossal squid: An eerie ambassador from the abyss,Earth,https://www.bbc.com/future/article/20250130-colossal-squid-the-eerie-ambassador-from-the-abyss
No targets for aviation or farming in UK climate plan,Earth,https://www.bbc.com/news/articles/cyv4g7000m4o
"Which is worse for wildlife, wind farms or oil drilling?",Earth,https://www.bbc.com/future/article/20250129-oil-vs-wind-which-is-worse-for-birds-and-whales
What happens to animals after a wildfire,Earth,https://www.bbc.com/future/article/20250128-how-wildlife-survives-after-wildfires
"Climate change made LA fires worse, scientists say",Earth,https://www.bbc.com/news/articles/cd9qy4knd8wo
The offices transforming into farms,Earth,https://www.bbc.com/future/article/20250127-why-veg-is-growing-in-empty-office-spaces
Why you might be throwing away the best bit of your fruit,Earth,https://www.bbc.com/future/article/20250124-eat-the-peel-why-you-might-be-throwing-away-the-best-bit-of-your-fruit
Climate and Nature Bill falls as MPs vote to end debate,Earth,https://www.bbc.com/news/articles/c8xqv1l4qxno
What is hiding under Greenland's ice?,Earth,https://www.bbc.com/future/article/20250121-the-enormous-challenge-of-mining-greenland
The cyborg forests revealing the secrets of trees,Earth,https://www.bbc.com/future/article/20250120-experimental-forests-reveal-the-ways-trees-help-cool-the-climate
Barcelona's urgent search for water after floods,Earth,https://www.bbc.com/future/article/20250116-barcelonas-urgent-search-for-water-after-floods
Planet-warming gas levels rose more than ever in 2024,Earth,https://www.bbc.com/news/articles/c30dn5dn53jo
Iranian director speaks out after Cannes triumph,Entertainment,https://www.bbc.com/news/articles/cm26v9dp9j1o
The 12 Cannes films you need to know about,Entertainment,https://www.bbc.com/culture/article/20250523-the-12-cannes-films-you-need-to-know-about
Graham Norton on his accidental cameo in Doctor Who,Entertainment,https://www.bbc.com/news/videos/cvg776gy7l6o
Mountainhead: A 'nightmare' vision of the world,Entertainment,https://www.bbc.com/culture/article/20250521-mountainhead-review
Billy Joel cancels tour after brain condition diagnosis,Entertainment,https://www.bbc.com/news/articles/cx2q95d4wy1o
Legendary photographer Sebastião Salgado dies at 81,Entertainment,https://www.bbc.com/news/articles/cx2exym29pdo
Why Sentimental Value is Cannes' buzziest film,Entertainment,https://www.bbc.com/culture/article/20250523-why-sentimental-value-is-being-called-the-best-film-you-might-see-all-year-cannes-film-festival
Taylor Swift won't face summons in Baldoni-Lively case,Entertainment,https://www.bbc.com/news/articles/cm2k0dmvvkgo
"Actor Jussie Smollett to pay $50,000 to Chicago charity",Entertainment,https://www.bbc.com/news/articles/c2lke8l980no
This Brazilian thriller could be an Oscars hopeful ★★★★☆,Entertainment,https://www.bbc.com/culture/article/20250523-the-secret-agent-review
Helping rescued elephants after circus life,Entertainment,https://www.bbc.com/news/videos/cn4gg9w99jmo
U2: 'We want to make the sound of the future',Entertainment,https://www.bbc.com/news/articles/cm2yl1n6kr5o
The Indian film that got a nine-minute ovation at Cannes,Entertainment,https://www.bbc.com/news/articles/czelypr8jdlo
'I'm hardly Bob Dylan': Charli XCX wins songwriter of the year,Entertainment,https://www.bbc.com/news/articles/cy75n53jk0ko
A furious but funny revenge thriller is a favourite at Cannes ★★★★☆,Entertainment,https://www.bbc.com/culture/article/20250522-it-was-just-an-accident-review
Gay romance The History of Sound is 'too polite' ★★☆☆☆,Entertainment,https://www.bbc.com/culture/article/20250521-the-history-of-sound-review-paul-mescal-and-josh-oconnors-gay-romance-is-too-polite
Chris Brown freed on £5m bail by London court,Entertainment,https://www.bbc.com/news/articles/cwy66xq1jjgo
Lineker's football podcast dropped by BBC after row,Entertainment,https://www.bbc.com/news/articles/c0qgg2qn8g1o
The sensational breakout star of The Phoenician Scheme,Entertainment,https://www.bbc.com/culture/article/20250521-the-sensational-break-out-star-of-the-phoenician-scheme
Israel's Eurovision result prompts questions over voting,Entertainment,https://www.bbc.com/news/articles/ckg77pxj2mno
Lorraine's ITV show cut to 30 minutes as job cuts loom,Entertainment,https://www.bbc.com/news/articles/cjwqqvqxzxlo
Jennifer Lopez sued in copyright case for posting photos of herself,Entertainment,https://www.bbc.com/news/articles/cx2qqew643go
This nightmarish virus horror is 'maddening' ★★☆☆☆,Entertainment,https://www.bbc.com/culture/article/20250520-alpha-review
How Gary Lineker's long BBC career came to an abrupt end,Entertainment,https://www.bbc.com/news/videos/c14kx2nyn7go
Lineker to leave BBC sooner than planned after antisemitism row,Entertainment,https://www.bbc.com/news/articles/c79e37nld1no
Gary Lineker: A sorry end to a BBC career,Entertainment,https://www.bbc.com/news/articles/cq54wy9jzgdo
How Gary Lineker went from football sensation to headline-hitting presenter,Entertainment,https://www.bbc.com/news/articles/cp39xlwexyxo
The only X-rated winner of the best-picture Oscar,Entertainment,https://www.bbc.com/culture/article/20250512-the-only-x-rated-winner-of-the-best-picture-oscar
Gary Lineker expected to leave the BBC,Entertainment,https://www.bbc.com/news/articles/c626jxp0yz3o
Wes Anderson takes his quirkiness to 'new levels' ★★★☆☆,Entertainment,https://www.bbc.com/culture/article/20250518-the-phoenician-scheme-review-wes-anderson-takes-his-quirkiness-to-a-whole-new-level
"Mission: Impossible returns, and Nine Perfect Strangers: What's coming up this week",Entertainment,https://www.bbc.com/news/articles/czxy550q6vzo
Remember Monday singer says she's lost wedding ring after Eurovision,Entertainment,https://www.bbc.com/news/articles/cjdzx5v21ldo
Former Little Mix singer Jesy Nelson gives birth to twins,Entertainment,https://www.bbc.com/news/articles/c628x34pwqvo
"Eurovision 2025: Austria wins with last-minute vote, as the UK comes 19th",Entertainment,https://www.bbc.com/news/articles/c15nq75274qo
The best photos from Eurovision Song Contest 2025,Entertainment,https://www.bbc.com/news/articles/ceqgjpl84pvo
Jennifer Lawrence is 'better than ever' in a searing portrait of motherhood ★★★☆☆,Entertainment,https://www.bbc.com/culture/article/20250517-die-my-love-review-jennifer-lawrence-is-better-than-ever-in-a-searing-portrait-of-motherhood
All you need to know about the Eurovision 2025 final,Entertainment,https://www.bbc.com/news/articles/cwywjw0y9rvo
Was Diddy a 'mastermind'? How ex Cassie's testimony builds the sex-trafficking case against him,Entertainment,https://www.bbc.com/news/articles/cvgvdr3gwneo
A shocking thriller about US pandemic divisions ★★★★☆,Entertainment,https://www.bbc.com/culture/article/20250516-eddington-review
Nemo: 'Winning Eurovision turned my life upside down',Entertainment,https://www.bbc.com/news/articles/c14kn1nymx0o
Frank Skinner gets married after four rejections from his now-wife,Entertainment,https://www.bbc.com/news/articles/c0mr1yewlr0o
How history's brutal witch trials resonate now,Entertainment,https://www.bbc.com/culture/article/20250516-how-historys-brutal-witch-trials-still-resonate-now
Teenager 'chases dream' and opens dance studio,Entertainment,https://www.bbc.com/news/articles/c5yxg0v06l4o
Ncuti Gatwa withdraws as UK's Eurovision jury announcer,Entertainment,https://www.bbc.com/news/articles/cj428knppygo
Israel qualifies for Eurovision final after protests disrupt rehearsal,Entertainment,https://www.bbc.com/news/articles/c780xn5p72jo
Weekly quiz: Which EastEnders star will be in Celebrity Traitors?,Entertainment,https://www.bbc.com/news/articles/cn05ywz2r9no
Chris Brown arrested over alleged bottle attack,Entertainment,https://www.bbc.com/news/articles/c15nzv18ddvo
One pair of jeans is all we need - here's why,Entertainment,https://www.bbc.com/culture/article/20250514-why-we-only-need-one-pair-of-jeans
Times reporter who exposed grooming gangs dies,Entertainment,https://www.bbc.com/news/articles/c4ge33q71q7o
Meet the 'invisible crew' who have 35 seconds to prevent a Eurovision blunder,Entertainment,https://www.bbc.com/news/articles/c1e679vn6yqo
Radio 2 breakfast audience drops after Zoe Ball's exit,Entertainment,https://www.bbc.com/news/articles/c861w2g71plo
Mission: Impossible – The Final Reckoning could be 'feel-bad film of the summer' ★★☆☆☆,Entertainment,https://www.bbc.com/culture/article/20250514-mission-impossible-the-final-reckoning-review
Lineker apologises for sharing 'offensive' Zionism post with rat image,Entertainment,https://www.bbc.com/news/articles/c365ernrnlyo
What a French icon's conviction means for France,Entertainment,https://www.bbc.com/culture/article/20250514-what-gerard-depardieus-conviction-means-for-france
Sophie Ellis-Bextor wants to celebrate being an older pop star,Entertainment,https://www.bbc.com/news/videos/crmkn0lk9eno
BBC boss vows to tackle Britain's 'crisis of trust',Entertainment,https://www.bbc.com/news/articles/cvg5p8z27z8o
Little Mermaid star gets restraining order against ex-partner DDG,Entertainment,https://www.bbc.com/news/articles/cz70qgvjvv1o
Falling in love - literally...,Entertainment,https://www.bbc.com/news/videos/c8xgjj0pl10o
What's it like to sketch Diddy in court?,Entertainment,https://www.bbc.com/news/videos/c70neev4djzo
Key looks from the Cannes Film Festival red carpet,Entertainment,https://www.bbc.com/news/videos/cvgn69g3n1ro
The meaning behind Cannes' 'naked dress' ban,Entertainment,https://www.bbc.com/culture/article/20250513-the-meaning-behind-cannes-naked-dress-red-carpet-ban
Star-studded Celebrity Traitors line-up confirmed,Entertainment,https://www.bbc.com/news/articles/cx2enyjk407o
The horror film that traumatised millennials,Entertainment,https://www.bbc.com/culture/article/20250512-the-horror-film-that-traumatised-millennials
EastEnders star Peace reveals cancer treatment,Entertainment,https://www.bbc.com/news/articles/cg5v28z0jjgo
Stars hit the Cannes Film Festival: Five things to look out for,Entertainment,https://www.bbc.com/news/articles/c0j78v19gp2o
Father Ted creator denies harassing trans woman,Entertainment,https://www.bbc.com/news/articles/c7879vg96y6o
The Bafta TV Awards in two minutes,Entertainment,https://www.bbc.com/news/videos/c7714xz1kn4o
The true story of World War Two's Dambusters raid,Entertainment,https://www.bbc.com/culture/article/20250509-the-true-story-of-world-war-twos-dambusters-raid
"Eurovision act Remember Monday: 'The closer we get, the hungrier we become'",Entertainment,https://www.bbc.com/news/articles/cy70zgyg3p6o
"Baftas 2025: A wedding dress, party plans and Alan Cumming's four suits",Entertainment,https://www.bbc.com/news/articles/cx2xn47vlv9o
Best moments of 2025 TV Baftas in under two minutes,Entertainment,https://www.bbc.com/news/videos/cyvm7y63r04o
Mr Bates and Mr Loverman win top Bafta Awards,Entertainment,https://www.bbc.com/news/articles/c1dep5ryd3vo
Bafta TV Awards: The winners list in full,Entertainment,https://www.bbc.com/news/articles/c4grlp8p264o
Billie Piper and Danny Dyer among stars on Baftas red carpet,Entertainment,https://www.bbc.com/news/articles/ckg4nge2m45o
Amber Heard announces birth of twins in Mother's Day post,Entertainment,https://www.bbc.com/news/articles/c79eznzx50vo
Yungblud: I've thought about becoming a politician,Entertainment,https://www.bbc.com/news/articles/cg5v6530y40o
Yungblud: 'I can't play a festival that's £800 a ticket',Entertainment,https://www.bbc.com/news/videos/c5y53yxz719o
Yungblud: 'I can't play a festival that's £800 a ticket',Entertainment,https://www.bbc.com/news/videos/cd908en0pe9o
Danny Dyer continued rehab after letter from daughter,Entertainment,https://www.bbc.com/news/articles/c7875y27y08o
Baby Reindeer and Mr Bates to compete at TV Baftas,Entertainment,https://www.bbc.com/news/articles/cvgpge1lmkyo
Taylor Swift criticises Lively-Baldoni court summons,Entertainment,https://www.bbc.com/news/articles/c1kv7v3z70jo
The design challenges of building Doctor Who's creepy creatures,Entertainment,https://www.bbc.com/news/videos/cvgpg7mekvmo
Hayley Atwell and Simon Pegg explain the 'bear rule',Entertainment,https://www.bbc.com/news/videos/cwy0zm1m2vko
'My brother died in Lockerbie - our story changed how air disasters are handled',Entertainment,https://www.bbc.com/news/articles/cpv4wz8rymxo
Molly-Mae confirms she and Tommy are back together,Entertainment,https://www.bbc.com/news/articles/crr7lv7pw2po
