headline,category,url
The Eurovision song that's caused outrage in Italy,Entertainment,https://www.bbc.com/culture/article/20250508-eurovision-2025-the-provocative-estonian-pop-song-that-has-outraged-some-italian
Four ways the film Conclave sheds light on the secretive way popes are chosen,Entertainment,https://www.bbc.com/news/articles/cgkg403x1gxo
Fifty Shades director James Foley dies aged 71,Entertainment,https://www.bbc.com/news/articles/c74qjvq2qzpo
Rediscovered Thomas & Friends pilot to be released,Entertainment,https://www.bbc.com/news/articles/czel5x60y7lo
Which city has the best nightlife? DJs Sherelle and Jamz decide,Entertainment,https://www.bbc.com/news/videos/c9qwqdew94lo
Why these 2000s indie heroes are back and bigger than ever,Entertainment,https://www.bbc.com/news/articles/cr5d04r634go
Weekly quiz: Which star showed off her baby bump at the Met Gala?,Entertainment,https://www.bbc.com/news/articles/c5ygl5r2jlqo
Strictly star reveals how to 'dance like your gran' for VE Day,Entertainment,https://www.bbc.com/news/videos/cyvmpqgj786o
Rape case against Oscar winner Haggis dropped,Entertainment,https://www.bbc.com/news/articles/c9wgj58wg45o
Why space-age design is back in fashion,Entertainment,https://www.bbc.com/culture/article/20250507-the-stunning-retro-space-age-homes-that-are-perfect-for-today
Rooney speaks of relief at end of Wagatha legal saga,Entertainment,https://www.bbc.com/news/articles/cd62yvp1g0xo
3 Doors Down singer reveals stage four cancer,Entertainment,https://www.bbc.com/news/articles/cp92rn8y5yjo
Exhibit explores team behind Sutton Hoo ship dig,Entertainment,https://www.bbc.com/news/articles/c5y6y75ykl5o
Smokey Robinson denies sexual assault allegations,Entertainment,https://www.bbc.com/news/articles/c3e5j8v227ko
Liam Payne left $31.9m fortune but had not made a will,Entertainment,https://www.bbc.com/news/articles/cx2821nz29ro
Meet the man who sketched the Sycamore Gap trial,Arts,https://www.bbc.com/news/articles/cp3nn6zxx6no
Cross-cultural ceilidh marks world diversity day,Arts,https://www.bbc.com/news/articles/c93l9zzgq4wo
Bygone photos show life in Wales' oldest multi-ethnic community,Arts,https://www.bbc.com/news/articles/c79edpj39r2o
Legendary photographer Sebastião Salgado dies at 81,Arts,https://www.bbc.com/news/articles/cx2exym29pdo
Arts and community projects receive cash boost,Arts,https://www.bbc.com/news/articles/cd62g7qv620o
International artist designs new Castleford mural,Arts,https://www.bbc.com/news/articles/c2lkkjxp8j0o
West End theatre to have its finances investigated,Arts,https://www.bbc.com/news/articles/cn8z141dvgdo
Flying geese mural 'reflects city's changing face',Arts,https://www.bbc.com/news/articles/cje77gq7583o
'High risk' theatre will close without urgent funds,Arts,https://www.bbc.com/news/articles/cvgqqypywe1o
'High risk' theatre will close without urgent funds,Arts,https://www.bbc.com/news/articles/cvgqqypywe1o
Life-sized animal puppets to stampede across London,Arts,https://www.bbc.com/news/articles/cgr55k5njgno
Artist's 'heartbreak' over AI generated images,Arts,https://www.bbc.com/news/articles/cvg5nz78ygdo
Classic Suffolk book to be adapted for the stage,Arts,https://www.bbc.com/news/articles/cgr55gkd92wo
Oldest theatre in fight to avoid programme cuts,Arts,https://www.bbc.com/news/articles/cy4kkv37ew7o
Artist wins award for exhibition exploring disability,Arts,https://www.bbc.com/news/articles/c6288q9gexno
Titan of Russian ballet Yuri Grigorovich dies at 98,Arts,https://www.bbc.com/news/articles/c4geede2g38o
'Tom Cruise got me to the Mission: Impossible premiere',Arts,https://www.bbc.com/news/videos/crljjn6779no
Jurassic snark: New Zealand dinosaur sculpture fuels debate,Arts,https://www.bbc.com/news/articles/c4g77x1m9mno
Festival to include walks of discovery on Dartmoor,Arts,https://www.bbc.com/news/articles/cwy3x12p00qo
Show planned for Oscar Wilde prison to be moved,Arts,https://www.bbc.com/news/articles/cpqe7x4pjy4o
Call the Midwife star backs fight to save theatre,Arts,https://www.bbc.com/news/articles/cjrn8r5394no
Art exhibition highlights problem of knife crime,Arts,https://www.bbc.com/news/articles/c39x00ln14zo
"'It took me almost 1,000 hours to draw London'",Arts,https://www.bbc.com/news/videos/c7876w8e751o
"'I've spent almost 1,000 hours on this drawing of London'",Arts,https://www.bbc.com/news/videos/cvgq8vxeq5jo
New exhibition for identical sister artists,Arts,https://www.bbc.com/news/articles/cdj9gkwem9po
Dock workers' stories wanted to inspire new play,Arts,https://www.bbc.com/news/articles/czdyle5n7qmo
Leonard Bernstein honoured by plaque for his work,Arts,https://www.bbc.com/news/articles/c0k35lj7rl8o
Charity art auction to support children in Nepal,Arts,https://www.bbc.com/news/articles/c4g2l5yyqxpo
Art and gardens at heart of sculpture exhibition,Arts,https://www.bbc.com/news/articles/c1degdz21vxo
'The pub was the one place men could socialise',Arts,https://www.bbc.com/news/articles/ckg4rm01zeeo
Repairs set to start on Raac-impacted theatre roof,Arts,https://www.bbc.com/news/articles/c4gr9qqq0gvo
Work exposes timber floor 'stood on by Shakespeare',Arts,https://www.bbc.com/news/articles/cvg7l9lqnyzo
Teenager 'chases dream' and opens dance studio,Arts,https://www.bbc.com/news/articles/c5yxg0v06l4o
All-inclusive musical theatre school set to open,Arts,https://www.bbc.com/news/articles/cx2x7ngy488o
'Dancing is so important for our wellbeing',Arts,https://www.bbc.com/news/videos/cvgve7kqrlqo
Son of war poet 'moved' by east London murals,Arts,https://www.bbc.com/news/articles/cwy71ld7jlpo
"More than 30,000 flowers go on display at cathedral",Arts,https://www.bbc.com/news/articles/c629wl64kryo
Show explores 'queer narratives' of Section 28's impact,Arts,https://www.bbc.com/news/articles/cdxgxd8g40do
Dance award launched to celebrate late Strictly star,Arts,https://www.bbc.com/news/articles/cpvkz34v4nro
Artists to document rewilding project,Arts,https://www.bbc.com/news/articles/cx2xndvz2qno
Rat sculptures damaged soon after going on display,Arts,https://www.bbc.com/news/articles/c1mglpmrrmvo
Charity and theatre promote mental health scheme,Arts,https://www.bbc.com/news/articles/c3v9q5rn511o
Art curator Koyo Kouoh dies at height of career,Arts,https://www.bbc.com/news/articles/cwynlr794j0o
Miners' strike legacy and loss viewed 40 years on,Arts,https://www.bbc.com/news/articles/cx2xlq7e92no
The 'remarkable place' where stars were made,Arts,https://www.bbc.com/news/articles/cvgd4mmvpnjo
Historical theatre to become more accessible,Arts,https://www.bbc.com/news/articles/c17rlwen1xzo
Typewriter artist to draw live at library event,Arts,https://www.bbc.com/news/articles/cql6lv4n073o
The photographs edited 150 years before Photoshop,Arts,https://www.bbc.com/news/articles/c5ygyww0zk3o
Play about road rage to premiere at city car park,Arts,https://www.bbc.com/news/articles/c2e3dy288yvo
UK tour of Jack Thorne's vampire play cancelled,Arts,https://www.bbc.com/news/articles/cwy73kzkj1vo
From Martin Fowler to Mr Darcy - EastEnders actor's new role,Arts,https://www.bbc.com/news/articles/cm23n79zgpmo
Council promises £5m for cultural projects,Arts,https://www.bbc.com/news/articles/cje72x82pvjo
Fishing catch inspires updated Liberation Day mural,Arts,https://www.bbc.com/news/articles/c74nlx0k107o
Damaged stalking dog sculpture removed for repairs,Arts,https://www.bbc.com/news/articles/ce8015pe5w1o
Three artists to have Pride work displayed,Arts,https://www.bbc.com/news/articles/cj098292rvzo
Bargain Hunt star charged over terrorist financing,Arts,https://www.bbc.com/news/articles/crr7lwx1zw1o
Pupils 'learnt so much' in Liberation musical,Arts,https://www.bbc.com/news/articles/cy5r57x2w61o
Dancing enthusiast celebrates 104th birthday,Arts,https://www.bbc.com/news/articles/cwyny118yx0o
"Alicia Vikander returns to stage after 17 years: 'I'm thrilled, but daunted'",Arts,https://www.bbc.com/news/articles/cly2jjg10xlo
Contemporary art trail begins in city centre,Arts,https://www.bbc.com/news/articles/cdrg7pjg8pvo
School granted rights for Frozen's West End show,Arts,https://www.bbc.com/news/articles/cy48z17dyjgo
Town's stalking dog to be recast after fundraiser,Arts,https://www.bbc.com/news/articles/c4g8g7d4d6do
Art museums could change thinking process - study,Arts,https://www.bbc.com/news/articles/czx1x6kdzreo
Search begins for new operator to run arts venue,Arts,https://www.bbc.com/news/articles/cy8q801j3x0o
Badminton 'for shopping' as well as horses,Arts,https://www.bbc.com/news/articles/cqx4nl0w8x4o
"Exhibition 'brings back memories', says internee",Arts,https://www.bbc.com/news/articles/cp8jdpglll5o
Quirky world of Wes Anderson set for London display,Arts,https://www.bbc.com/news/articles/c0jz38n9eldo
Banksy's legacy amid steelworks loss fuels new play,Arts,https://www.bbc.com/news/articles/cy9vw540zngo
Lockdown artist hosting first exhibition,Arts,https://www.bbc.com/news/articles/cpdz0p34v34o
"Cathedral wants artists to mark 1,400th birthday",Arts,https://www.bbc.com/news/articles/cjwve6pzq84o
"Belly dancer, 84, has navel approach to exercise",Arts,https://www.bbc.com/news/articles/c9342931pk2o
Theatre reopens with charity gala after Raac repairs,Arts,https://www.bbc.com/news/articles/cn4j53vqxqno
Retired dancer returns to stage four decades on,Arts,https://www.bbc.com/news/articles/c1egxg87zzgo
Exhibition looks at how Shakespeare began to write,Arts,https://www.bbc.com/news/articles/c9ve2123zy8o
Festival 'survived all sorts' as it celebrates 25th anniversary,Arts,https://www.bbc.com/news/articles/c3evq307348o
Theatre shuts for 7 months as £3.5m revamp begins,Arts,https://www.bbc.com/news/articles/cn5xnlv09eko
Free arts festival draws thousands of spectators,Arts,https://www.bbc.com/news/articles/cly507y6xq2o
Exhibit lets visitors walk through Lowry painting,Arts,https://www.bbc.com/news/articles/cx26zjqd70yo
Science meets shape-throwing in 'Dance your PhD' contest,Arts,https://www.bbc.com/news/videos/c70zdwyp9zeo
City hosts giant rats in sculpture trail for charity,Arts,https://www.bbc.com/news/articles/cm2xm5d4yjpo
Art gallery marks 'milestone moment' of 125 years,Arts,https://www.bbc.com/news/articles/c4g2m3x4861o
Culture leaders 'unwilling' to police which toilets people use,Arts,https://www.bbc.com/news/articles/c4g7j5r0qpyo
Derry dance company 'shocked' at 100% funding cut,Arts,https://www.bbc.com/news/articles/c0qnx943j2qo
How local theatre made shy teen into West End star,Arts,https://www.bbc.com/news/articles/c14xdn4y07xo
Theatre praises Oldman's 'thrilling' York return,Arts,https://www.bbc.com/news/articles/c9qw910q875o
Mosaic artist uses biscuits to make famous faces,Arts,https://www.bbc.com/news/articles/c74zg7dd2j0o
Open air theatre raises curtain on 11th season,Arts,https://www.bbc.com/news/articles/c05nq8600gzo
David Bowie to Doctor Who: Famous faces come to life in art show,Arts,https://www.bbc.com/news/articles/cdxg094zk58o
George Clooney gets Tony nomination for Broadway debut,Arts,https://www.bbc.com/news/articles/cgjlq282px7o
First female CEO for 130-year-old theatre,Arts,https://www.bbc.com/news/articles/c87pv804198o
BBC Proms to return to Bristol Beacon,Arts,https://www.bbc.com/news/articles/c4g2dr0k68mo
Stone lion sculpture gets facelift to match twin,Arts,https://www.bbc.com/news/articles/c2kv7pnx28qo
Plans to revamp 'historic' theatre reach milestone,Arts,https://www.bbc.com/news/articles/c9ve2vr4pw0o
Mescal and Stormzy set for National Theatre shows,Arts,https://www.bbc.com/news/articles/creqlgp47plo
Town's landmarks 'brought to life' in new art show,Arts,https://www.bbc.com/news/articles/c5y5zk78qr8o
'Inspiring' Museum of the Year nominees all outside London,Arts,https://www.bbc.com/news/articles/ce3v7ngn7nvo
Museum showcases Terry Pratchett's Discworld art,Arts,https://www.bbc.com/news/articles/c77nmxnrjljo
Underpass mural designed to 'inspire positivity',Arts,https://www.bbc.com/news/articles/cpwzev009qgo
Child damages €50m Rothko painting in Dutch museum,Arts,https://www.bbc.com/news/articles/cz6dvdwjpj4o
Should US travellers rethink their summer holiday?,Travel,https://www.bbc.com/travel/article/20250520-the-us-travellers-afraid-to-travel-abroad-right-now
The New York fort that changed history,Travel,https://www.bbc.com/travel/article/20250516-the-new-york-fort-that-changed-history
The world's five happiest cities for 2025,Travel,https://www.bbc.com/travel/article/20250515-the-worlds-five-happiest-cities-for-2025
What does a pope's hometown reveal?,Travel,https://www.bbc.com/travel/article/20250514-where-popes-come-from-and-why-it-matters
8 ways to travel more sustainably in 2025,Travel,https://www.bbc.com/travel/article/20250509-8-ways-to-travel-more-sustainably-in-2025
Where do all those Mother's Day flowers come from?,Travel,https://www.bbc.com/travel/article/20240514-the-south-american-country-supplying-mothers-day-flowers
The unstoppable rise of digital detox retreats,Travel,https://www.bbc.com/travel/article/20250507-the-unstoppable-rise-of-digital-detox-retreats
What you need to know about US Real ID,Travel,https://www.bbc.com/travel/article/20250505-real-id-the-big-change-affecting-us-air-travel
The viral Italian island that defies expectations,Travel,https://www.bbc.com/travel/article/20250502-anacapri-the-overlooked-quiet-corner-of-capri
A chef's guide to the best cacio e pepe in Rome,Travel,https://www.bbc.com/travel/article/20250513-the-pasta-queens-favourite-cacio-e-pepe-in-rome
What does a pope's hometown reveal?,Travel,https://www.bbc.com/travel/article/20250514-where-popes-come-from-and-why-it-matters
Destination dupes: Where to go instead of the US,Travel,https://www.bbc.com/travel/article/20250514-destination-dupes-where-to-go-instead-of-the-us
Five celeb-worthy ways to experience Cannes,Travel,https://www.bbc.com/travel/article/20240517-a-weekend-in-cannes-with-an-attach-to-the-stars
How Mexico transformed its Alcatraz,Travel,https://www.bbc.com/travel/article/20250512-islas-marias-a-notorious-prison-island-turned-natural-paradise
8 ways to travel more sustainably in 2025,Travel,https://www.bbc.com/travel/article/20250509-8-ways-to-travel-more-sustainably-in-2025
Where do all those Mother's Day flowers come from?,Travel,https://www.bbc.com/travel/article/20240514-the-south-american-country-supplying-mothers-day-flowers
The flawless biscuit that took years to master,Travel,https://www.bbc.com/travel/article/20250509-the-flawless-biscuit-that-took-years-to-master
Exploring Australia's 'magical' glow-in-the-dark world,Travel,https://www.bbc.com/travel/article/20250508-australias-mysterious-glowing-big-four
The unstoppable rise of digital detox retreats,Travel,https://www.bbc.com/travel/article/20250507-the-unstoppable-rise-of-digital-detox-retreats
Where to get New York City's best Chinese food,Travel,https://www.bbc.com/travel/article/20250505-where-to-get-new-york-citys-best-chinese-food
What you need to know about US Real ID,Travel,https://www.bbc.com/travel/article/20250505-real-id-the-big-change-affecting-us-air-travel
The viral Italian island that defies expectations,Travel,https://www.bbc.com/travel/article/20250502-anacapri-the-overlooked-quiet-corner-of-capri
How Dubai chocolate sparked a global frenzy,Travel,https://www.bbc.com/travel/article/20250502-how-dubai-chocolate-conquered-the-world
The artichoke so prized that people sell fakes,Travel,https://www.bbc.com/travel/article/20250502-the-artichoke-so-prized-that-people-sell-fakes
London's newest hip area isn't where you think,Travel,https://www.bbc.com/travel/article/20250501-now-is-the-time-to-explore-outer-east-london
The secrets of feeding the papal conclave,Travel,https://www.bbc.com/travel/article/20250430-the-secrets-of-feeding-the-papal-conclave
A Hollywood director's top cocktail bars around the world,Travel,https://www.bbc.com/travel/article/20250424-paul-feigs-top-cocktail-bars-around-the-world
How a smiling animal put an island on the map,Travel,https://www.bbc.com/travel/article/20250424-the-indian-oceans-laid-back-paradise-on-earth
The European nation where bears are booming,Travel,https://www.bbc.com/travel/article/20250425-the-european-nation-where-bears-roam-free
Scotland's most remote railway adventure,Travel,https://www.bbc.com/travel/article/20250423-scotlands-most-remote-railway-adventure
A US island with no cars and 600 horses,Travel,https://www.bbc.com/travel/article/20250425-the-us-island-where-cars-are-banned
Inside the fortress that inspired Hamlet,Travel,https://www.bbc.com/travel/article/20250416-inside-the-fortress-that-inspired-hamlet
Eight Asian sauces to keep in your pantry,Travel,https://www.bbc.com/travel/article/20250423-the-eight-asian-sauces-to-keep-in-your-pantry
The secret keepers of Japan's cherry blossoms,Travel,https://www.bbc.com/travel/article/20250422-japans-97-year-old-cherry-blossom-guardian
The first king to travel around the world,Travel,https://www.bbc.com/travel/article/20230521-king-david-laamea-kalkaua-the-first-king-to-travel-around-the-world
Flying high: Delhi's only female pigeon keeper,Travel,https://www.bbc.com/travel/article/20250417-inside-the-life-of-old-delhis-only-female-pigeon-keeper
The stunning landscapes behind Pride and Prejudice,Travel,https://www.bbc.com/travel/article/20250418-a-guide-to-jane-austens-derbyshire-england
The recipe for a centuries-old Easter baba made with 96 eggs,Travel,https://www.bbc.com/travel/article/20240327-the-centuries-old-baba-recipe-made-with-96-egg-yolks
The baffling purple honey only found in the US South,Travel,https://www.bbc.com/travel/article/20250417-the-baffling-purple-honey-found-only-in-north-carolina
What it's like to live in the world's happiest country,Travel,https://www.bbc.com/travel/article/20250416-what-its-like-to-live-in-the-happiest-country-on-earth
How to have a self-care holiday in Seoul,Travel,https://www.bbc.com/travel/article/20250415-chriselle-lims-self-care-guide-to-seoul
How resorts are rethinking the all-inclusive holiday,Travel,https://www.bbc.com/travel/article/20250415-why-all-inclusive-resorts-are-sending-guests-off-site
South Africa's new 'Big Five' safari destination,Travel,https://www.bbc.com/travel/article/20250414-south-africas-new-big-five-safari-destination
Thailand's cooling rice dish to beat the heat,Travel,https://www.bbc.com/travel/article/20240412-thailands-cooling-rice-dish-to-beat-the-heat
Songkran: The world's biggest water fight,Travel,https://www.bbc.com/travel/article/20250411-songkran-the-worlds-biggest-water-fight
Why Iceland is getting happier every year,Travel,https://www.bbc.com/travel/article/20250411-why-icelanders-are-happier-than-ever
Britain's new foodie town with six Michelin stars,Travel,https://www.bbc.com/travel/article/20250410-britains-tastiest-town-where-michelin-chefs-and-gingerbread-queens-reign
Which version of the US will visitors find?,Travel,https://www.bbc.com/travel/article/20250409-which-version-of-the-us-will-visitors-find
A chef's guide to Rome’s best Jewish food,Travel,https://www.bbc.com/travel/article/20250407-where-to-savour-romes-hidden-jewish-food
Europe's most exciting getaways for 2025 travel,Travel,https://www.bbc.com/travel/article/20250407-best-european-vacation-destinations
"The 2,000-year-old US mystery mounds",Travel,https://www.bbc.com/travel/article/20221204-the-us-2000-year-old-mystery-mounds
A 58-tunnel train through India's Eastern Ghats,Travel,https://www.bbc.com/travel/article/20250404-a-58-tunnel-slow-train-through-indias-eastern-ghats
A White Lotus actor's guide to Thailand,Travel,https://www.bbc.com/travel/article/20250225-a-white-lotus-actors-guide-to-thailand
In search of Greece's once-great Jewish city,Travel,https://www.bbc.com/travel/article/20250404-in-search-of-greeces-once-great-jewish-city
The vital tradition of naming baby gorillas,Travel,https://www.bbc.com/travel/article/20250402-the-vital-tradition-of-naming-baby-gorillas-rwanda
Where to find the world's most beautiful sunsets,Travel,https://www.bbc.com/travel/article/20250331-italy-dolomites-the-magic-of-the-legendary-enrosadira
An F1 driver's fast and furious guide to Tokyo,Travel,https://www.bbc.com/travel/article/20250401-yuki-tsunoda-f1-an-off-the-grid-guide-to-tokyo
Hawaii's ancient concept of 'mālama',Travel,https://www.bbc.com/travel/article/20250331-the-word-embodying-the-spirit-of-hawaii
The growing call to boycott travel to the US,Travel,https://www.bbc.com/travel/article/20250328-the-people-boycotting-travel-to-the-us
A sacred journey connecting Jordan and Spain,Travel,https://www.bbc.com/travel/article/20250328-the-revival-of-jordans-1600-year-old-camino
The return of Sicily's ancient 'white gold',Travel,https://www.bbc.com/travel/article/20250328-the-return-of-sicilys-ancient-white-gold
Ottolenghi: Food is how we connect,Travel,https://www.bbc.com/travel/article/20250327-yotam-ottolenghi-interview-influential-katty-kay
Kandi Burruss's weekend guide to Atlanta,Travel,https://www.bbc.com/travel/article/20250325-kandi-burruss-weekend-guide-to-atlanta
Finding calm in the cosmos: A new wellness trend,Travel,https://www.bbc.com/travel/article/20250324-star-bathing-the-next-big-thing-in-travel
The European nation where horses roam free,Travel,https://www.bbc.com/travel/article/20250324-the-european-nation-where-horses-roam-free
The unexpected origins of Houston's iconic po' boy,Travel,https://www.bbc.com/travel/article/20250321-the-unexpected-origins-of-houstons-favourite-po-boy
The Pacific islands that don't want to be Hawaii,Travel,https://www.bbc.com/travel/article/20250319-the-cook-islands-paradise-that-doesnt-want-to-be-hawaii
How women are driving the future of travel,Travel,https://www.bbc.com/travel/article/20250321-female-first-travel-the-ultimate-guide
How to visit a glacier without harming it,Travel,https://www.bbc.com/travel/article/20250319-the-un-declared-2025-as-the-year-of-glacier-preservation-visit-one-safely
The US island that feels like Russia,Travel,https://www.bbc.com/travel/article/20180724-the-us-island-that-once-belonged-to-russia
Where to see spring tulips in the Netherlands,Travel,https://www.bbc.com/travel/article/20240330-a-local-experts-guide-to-seeing-the-most-beautiful-tulips-in-the-netherlands
The ethics of visiting the ends of the Earth,Travel,https://www.bbc.com/travel/article/20250314-visiting-antarctica-or-the-arctic-heres-how-to-minimise-your-impact
A second chance for Malta's paradise island turned 'hell on Earth',Travel,https://www.bbc.com/travel/article/20250314-a-second-chance-for-maltas-paradise-island-comino
A stunning car-free village reached by cable car,Travel,https://www.bbc.com/travel/article/20250314-murren-the-stunning-car-free-village-reached-by-cable-car
Lithuania's fermented drink to ward off a cold,Travel,https://www.bbc.com/travel/article/20250313-lithuanias-fermented-drink-to-ward-off-a-cold
A beloved dessert linked to a brutal legend,Travel,https://www.bbc.com/travel/article/20250312-om-ali-an-unforgettable-sweet-with-a-sinister-history
Should tourists hike the Inca Trail?,Travel,https://www.bbc.com/travel/article/20250312-an-ethical-guide-to-hiking-the-inca-trail
An Italian cultural ambassador's guide to Rome,Travel,https://www.bbc.com/travel/article/20250310-alberto-angela-an-italian-cultural-ambassadors-guide-to-rome
Spain's 'Jurassic Park' of citrus farms,Travel,https://www.bbc.com/travel/article/20250307-the-art-curator-saving-the-worlds-rarest-fruit
The US island that speaks Elizabethan English,Travel,https://www.bbc.com/travel/article/20190623-the-us-island-that-speaks-elizabethan-english
Is there such a thing as guilt-free safari?,Travel,https://www.bbc.com/travel/article/20250306-why-travellers-are-seeking-out-guilt-free-safaris
